{"$schema":"../schemas/deployment_inventory.schema.json","schema_version":"2.0","environment":"staging","agents":[{"id":"claims-agent","version":"1.2.0"}],"collected_facts":[{"category":"iam","sub_score":"access_control","finding":"policy inventory supplied","status":"present","evidence_uris":["evidence://iam/policy"],"evidence_quality":{"source":"fixture","freshness":"declared","confidence":0.8}}],"missing_evidence":[{"category":"rollback","sub_score":"rollback_plan","reason":"no executable rollback evidence supplied","evidence_quality":{"source":"fixture","freshness":"not_observed","confidence":0.8}}]}
